{
  "affects": [
    ".game/ANIMATION.md"
  ],
  "decided_at": "2026-01-02T09:00:00Z",
  "decided_by": {
    "id": "creative-lead",
    "kind": "HUMAN"
  },
  "decision": {
    "verbatim": "In-place locomotion; root motion only for authored traversal."
  },
  "decision_id": "D-0101",
  "kind": "LOCK",
  "schema_version": "1.0",
  "status": "ACTIVE",
  "subject": {
    "kind": "PROJECT",
    "ref": "synthetic-adapter-project"
  },
  "transcribed_by": {
    "id": "game-director",
    "kind": "AGENT"
  }
}
